{
  "$schema": "https://json-schema.org/draft/2020-12/schema",
  "$id": "validation/case.schema.json",
  "title": "hexmesh validation case",
  "description": "validation/<case>/case.json: a case's category, references, tags, status, gates and task (decision 0012, amendment 2026-10-30; task 0073).",
  "type": "object",
  "required": ["schemaVersion", "title", "category", "references", "tags", "status", "gates", "task"],
  "additionalProperties": false,
  "properties": {
    "schemaVersion": {"const": 1},
    "title": {"type": "string", "minLength": 1},
    "category": {
      "description": "The strongest reference: V1 exact solution, V2 high-fidelity simulation, V3 experiment, V4 correlation or standard.",
      "enum": ["V1", "V2", "V3", "V4"]
    },
    "references": {
      "type": "array",
      "minItems": 1,
      "items": {
        "type": "object",
        "required": ["source", "role"],
        "additionalProperties": false,
        "properties": {
          "key": {"description": "Citation key in docs/references.bib; absent for an analytic solution derived in the case.", "type": "string"},
          "source": {"description": "What is compared: the solution, table or data set.", "type": "string", "minLength": 1},
          "role": {"enum": ["primary", "secondary"]}
        }
      }
    },
    "tags": {
      "type": "object",
      "required": ["regime", "physics", "features", "toolchain"],
      "additionalProperties": false,
      "properties": {
        "regime": {
          "description": "Empty for solid conduction (no flow).",
          "type": "array",
          "items": {"type": "string", "pattern": "^(laminar|transient|transitional|rans:[A-Za-z0-9-]+)$"},
          "uniqueItems": true
        },
        "physics": {
          "type": "array",
          "minItems": 1,
          "items": {"enum": ["flow", "cht", "conduction"]},
          "uniqueItems": true
        },
        "features": {
          "description": "The hexmesh features the case exercises (decision 0012's fixed list).",
          "type": "array",
          "minItems": 1,
          "items": {"enum": ["section:circle", "section:rect", "layers", "straight", "bend",
                             "miter", "spline", "profiled-reducer", "transition", "tee",
                             "duct-tap", "wye", "stack-changes", "projection"]},
          "uniqueItems": true
        },
        "toolchain": {
          "type": "object",
          "required": ["openfoam", "runner"],
          "additionalProperties": false,
          "properties": {
            "openfoam": {"type": "string", "pattern": "^v[0-9]{4}$"},
            "runner": {"enum": ["native", "docker"]}
          }
        }
      }
    },
    "status": {"enum": ["planned", "in progress", "accepted", "rejected"]},
    "gates": {
      "type": "array",
      "items": {
        "type": "object",
        "required": ["quantity", "limit"],
        "additionalProperties": false,
        "properties": {
          "quantity": {"type": "string", "minLength": 1},
          "limit": {"type": "string", "minLength": 1}
        }
      }
    },
    "task": {"type": "string", "pattern": "^[0-9]{4}$"}
  }
}
